skills;job_desc_text;AI_skills_found;AI_skill_hard;id;job_title;location;company_id;company;age_in_days;pay_currency;pay_period;salary_min;salary_mid;salary_max;rating;discover_date;job_types;remote_work_types;educations;job_desc_html;city;state;country;latitude;longitude;ceo;headquarters;industry;sector;revenue;size;type;website;year_founded
Computer science, Elasticsearch, Power BI, CSS, Bootstrap, Customer service, .NET Core, C#, Process improvement, Git, Research, MongoDB, Tableau, Performance testing, Java, SOAP, Redis, Mentoring, Scalability, Unit testing, DynamoDB, Communication skills, Python, T-SQL;"We are proud to be consistently recognized as one of the world’s best places to work, a champion of diversity and a model of social responsibility. We are currently #1 ranked consulting firm on Glassdoor’s Best Places to Work list and have maintained a spot in the top four on Glassdoor’s list for the last 13 years. We believe that diversity, inclusion and collaboration is key to building extraordinary teams. We hire people with exceptional talents, abilities and potential, then create an environment where you can become the best version of yourself and thrive both professionally and personally. We are publicly recognized by external parties such as Fortune, Vault, Mogul, Working Mother, Glassdoor and the Human Rights Campaign for being a great place to work for diversity and inclusion, women, LGBTQ and parents.
WHAT MAKES US A GREAT PLACE TO WORK
WHO YOU WILL WORK WITH
You’ll join our engineering experts within Bain’s global digital capabilities practice. This team designs, builds, and supports Bain’s most strategic internal software systems, used by colleagues around the world. You’ll work in a collaborative, agile environment with engineers, designers, and product managers to deliver enterprise-scale web and mobile applications that power Bain’s business.
As a Software Engineer, you’ll play a key role in building and enhancing internal applications that support Bain’s business priorities. You’ll work on an Agile/Scrum team, contributing technical expertise, mentoring junior engineers, and helping drive high-quality delivery at scale.
WHERE YOU’LL FIT WITHIN THE TEAM
WHAT YOU’LL DO
Contribute to software development delivery (80%) by designing, coding, testing, and maintaining enterprise applications
Work as a member of an Agile team, participating in all ceremonies and sprint activities
Break down user stories into tasks and deliver features that meet functional and non-functional requirements (scalability, performance, etc.)
Prepare work estimates, write and execute unit tests, and participate in application release testing
Provide support for applications in production, including troubleshooting and resolution
Continuously learn and apply new skills (e.g., automation, DevOps, UX design, performance testing) to broaden technical expertise
Follow Bain’s development processes and contribute to the ongoing improvement of team practices and standards
Conduct research (10%) to evaluate and recommend new tools, technologies, and approaches for future initiatives
Share knowledge with peers and enhance team experience through effective communication (10%)
ABOUT YOU
Bachelor’s degree (or equivalent) in Computer Science, Engineering, or related field
Proven experience developing enterprise-scale applications
Strong knowledge of agile software development methodologies and processes
Record of strong performance in prior software engineering roles
Strong problem-solving, communication, and customer service skills
Demonstrated ability to collaborate across disciplines and manage competing priorities
3 years minimum relevant experience (and GenAI) preferred
Software Engineering
Frameworks: .NET, .NET Core
Languages: C#, T-SQL, Python
Web: Angular, React, JavaScript, HTML, CSS, Bootstrap
RDBMS: Microsoft SQL Server
Cloud: Microsoft Azure Services
Testing: XUnit, Jasmine
DevOps: GitActions
Search: Elasticsearch, Coveo
NoSQL: MongoDB, Cosmos
Caching: Redis, MemCache
Data Engineering
Languages: T-SQL
Data & Analytics: Microsoft SQL Server, Azure SQL, Data Lake, Blob Storage, Synapse, Analysis Services
ETL: Talend, Azure Data Factory
Visualization: Tableau, Power BI
Automation / Low Code
Experience in C#, Java, Python, JavaScript
Strong RDBMS knowledge (SQL Server, Oracle, MySQL, PostgreSQL, MS Dataverse)
Familiarity with REST/SOAP APIs, IT infrastructure, and enterprise access management
RPA: Automation Anywhere, Blue Prism, Power Automate, UiPath
Low-Code: Power Apps, Appian, OutSystems
Workflow: Power Automate, Nintex
Front-end: HTML, CSS, React, Bootstrap, Angular
Security: Key Vaults (Hashicorp, Azure), OAUTH2, JWT, Azure Managed Identities
U.S. COMPENSATION INFORMATION
Compensation for this role includes base salary, annual discretionary performance bonus, 401(k) plan with an annual employer contribution based on years of service, and Bain’s best-in-class benefits package.
Some local governments in the United States require a good-faith, reasonable salary range be included in job postings for open roles. The estimated annualized compensation for this role is as follows:
In Texas, the good-faith, reasonable full-time salary range for this role is between
; placement within this range will vary based on several factors including, but not limited to, experience, education, licensure/certifications, training, and skill level.
$74,000-$88,500
Additional compensation may include:
Annual discretionary performance bonus
4.5% 401(k) company contribution, increasing after 3 years and fully vested upon start
Full coverage of individual medical, dental, and vision premiums
Generous paid time off, including parental leave and holidays
Paid life and long-term disability insurance
Annual fitness reimbursement";;0;38;Software Engineer (Full Stack Developer);Dallas, TX;3752.0;Bain & Company Inc;0;USD;ANNUAL;74000.0;81250.0;88500.0;4.3;2025-10-07T00:00:00;Full-time;;Bachelor's degree;"<div><p><b>WHAT MAKES US A GREAT PLACE TO WORK</b><br>
We are proud to be consistently recognized as one of the world&rsquo;s best places to work, a champion of diversity and a model of social responsibility. We are currently #1 ranked consulting firm on Glassdoor&rsquo;s Best Places to Work list and have maintained a spot in the top four on Glassdoor&rsquo;s list for the last 13 years. We believe that diversity, inclusion and collaboration is key to building extraordinary teams. We hire people with exceptional talents, abilities and potential, then create an environment where you can become the best version of yourself and thrive both professionally and personally. We are publicly recognized by external parties such as Fortune, Vault, Mogul, Working Mother, Glassdoor and the Human Rights Campaign for being a great place to work for diversity and inclusion, women, LGBTQ and parents.</p><p><b>
WHO YOU WILL WORK WITH</b></p><p>
You&rsquo;ll join our engineering experts within Bain&rsquo;s global digital capabilities practice. This team designs, builds, and supports Bain&rsquo;s most strategic internal software systems, used by colleagues around the world. You&rsquo;ll work in a collaborative, agile environment with engineers, designers, and product managers to deliver enterprise-scale web and mobile applications that power Bain&rsquo;s business.</p><p></p><p><b><br>
WHERE YOU&rsquo;LL FIT WITHIN THE TEAM</b><br>
As a Software Engineer, you&rsquo;ll play a key role in building and enhancing internal applications that support Bain&rsquo;s business priorities. You&rsquo;ll work on an Agile/Scrum team, contributing technical expertise, mentoring junior engineers, and helping drive high-quality delivery at scale.</p><p></p><p><b><br>
WHAT YOU&rsquo;LL DO</b></p><ul><li>
Contribute to software development delivery (80%) by designing, coding, testing, and maintaining enterprise applications</li><li>
Work as a member of an Agile team, participating in all ceremonies and sprint activities</li><li>
Break down user stories into tasks and deliver features that meet functional and non-functional requirements (scalability, performance, etc.)</li><li>
Prepare work estimates, write and execute unit tests, and participate in application release testing</li><li>
Provide support for applications in production, including troubleshooting and resolution</li><li>
Continuously learn and apply new skills (e.g., automation, DevOps, UX design, performance testing) to broaden technical expertise</li><li>
Follow Bain&rsquo;s development processes and contribute to the ongoing improvement of team practices and standards</li><li>
Conduct research (10%) to evaluate and recommend new tools, technologies, and approaches for future initiatives</li><li>
Share knowledge with peers and enhance team experience through effective communication (10%)</li></ul><p></p><p><b><br>
ABOUT YOU</b></p><ul><li>
Bachelor&rsquo;s degree (or equivalent) in Computer Science, Engineering, or related field</li><li>
Proven experience developing enterprise-scale applications</li><li>
Strong knowledge of agile software development methodologies and processes</li><li>
Record of strong performance in prior software engineering roles</li><li>
Strong problem-solving, communication, and customer service skills</li><li>
Demonstrated ability to collaborate across disciplines and manage competing priorities</li><li>
3 years minimum relevant experience (and GenAI) preferred</li></ul><p><b>
Software Engineering</b></p><ul><li>
Frameworks: .NET, .NET Core</li><li>
Languages: C#, T-SQL, Python</li><li>
Web: Angular, React, JavaScript, HTML, CSS, Bootstrap</li><li>
RDBMS: Microsoft SQL Server</li><li>
Cloud: Microsoft Azure Services</li><li>
Testing: XUnit, Jasmine</li><li>
DevOps: GitActions</li><li>
Search: Elasticsearch, Coveo</li><li>
NoSQL: MongoDB, Cosmos</li><li>
Caching: Redis, MemCache</li></ul><p><b>
Data Engineering</b></p><ul><li>
Languages: T-SQL</li><li>
Data &amp; Analytics: Microsoft SQL Server, Azure SQL, Data Lake, Blob Storage, Synapse, Analysis Services</li><li>
ETL: Talend, Azure Data Factory</li><li>
Visualization: Tableau, Power BI</li></ul><p><b>
Automation / Low Code</b></p><ul><li>
Experience in C#, Java, Python, JavaScript</li><li>
Strong RDBMS knowledge (SQL Server, Oracle, MySQL, PostgreSQL, MS Dataverse)</li><li>
Familiarity with REST/SOAP APIs, IT infrastructure, and enterprise access management</li><li>
RPA: Automation Anywhere, Blue Prism, Power Automate, UiPath</li><li>
Low-Code: Power Apps, Appian, OutSystems</li><li>
Workflow: Power Automate, Nintex</li><li>
Front-end: HTML, CSS, React, Bootstrap, Angular</li><li>
Security: Key Vaults (Hashicorp, Azure), OAUTH2, JWT, Azure Managed Identities</li></ul><p></p><p><b><br>
U.S. COMPENSATION INFORMATION</b></p><p>
Compensation for this role includes base salary, annual discretionary performance bonus, 401(k) plan with an annual employer contribution based on years of service, and Bain&rsquo;s best-in-class benefits package.</p><p></p><p><br>
Some local governments in the United States require a good-faith, reasonable salary range be included in job postings for open roles. The estimated annualized compensation for this role is as follows:</p><br>
<p></p><ul><li>
In Texas, the good-faith, reasonable full-time salary range for this role is between <b>$74,000-$88,500</b>; placement within this range will vary based on several factors including, but not limited to, experience, education, licensure/certifications, training, and skill level.</li></ul><p></p><p><br>
Additional compensation may include:</p><ul><li>
Annual discretionary performance bonus</li><li>
4.5% 401(k) company contribution, increasing after 3 years and fully vested upon start</li><li>
Full coverage of individual medical, dental, and vision premiums</li><li>
Generous paid time off, including parental leave and holidays</li><li>
Paid life and long-term disability insurance</li><li>
Annual fitness reimbursement</li></ul></div>";Dallas, TX;Texas;United States;32.78333;-96.8;Christophe De Vusser;Boston, MA;Business Consulting;Management & Consulting;$5 to $10 billion (USD);10000+ Employees;Company - Private;https://www.bain.com;1973.0
Google Cloud Platform, SQL, Project management, Docker, Machine learning, Cloud development, Terraform, Django, Software testing, AI, GitLab;"AMP is applying AI-powered sortation at scale to modernize the world's recycling infrastructure and maximize the value in waste. AMP gives waste and recycling leaders the power to harness AI to reduce labor costs, increase resource recovery, and deliver more reliable operations. With hundreds of deployments across North America, Asia, and Europe, AMP's technology offers a transformational solution to waste sortation and changes the fundamental economics of recycling.
Headquartered in Louisville, Colorado, the Denver Post and BuiltIn Colorado have recognized AMP as one of the state's top workplaces. AMP has operations and career opportunities outside of Atlanta, Cleveland, Portsmouth, Virginia, and Europe. We're fostering an environment where passionate individuals can grow and create impact. We seek unconventional thinkers to join our mission to enable a world without waste; at AMP, your contributions have meaning and can spur change. With backing from top-tier investors and national recognition including North American Cleantech Company of the Year, we're always seeking ways to better our operations, raising the bar on innovation, and looking to collaborate and improve in what we do. Learn more at AMPSortation.com.
is hiring a
reporting to
on a remote basis.
AMP
Full-stack Software Engineer
Engineering Manager, Machine Learning
AMP doesn't just do machine learning, we are driven forward by it. Our core technology revolves around deep-learned models applied to robotics domains, and we are always striving to level up our offering. In this role, you'll help build and improve our ML Platform—especially the Data Annotation Platform and its supporting cloud infrastructure—working closely with our ML and Data Operations teams.
As a
you will work to:
Full-stack Software Engineer,
Be responsible for contributing to the maintenance and feature development of our Data Annotation platform and surrounding cloud infrastructure
Contribute to cross-functional projects and development efforts to support our AI lifecycle and ML platform.
Supervisory Responsibilities:
None
The successful candidate will have:
Required:
5+ years of professional experience in software engineering
2-4 years experience writing production-level code in Python
2-4 years experience writing production-level code in a modern frontend Javascript framework (Angular preferred)
2+ years experience working with SQL databases and data pipelines
1+ years experience in container orchestration (Kubernetes, Docker) and CI/CD development (Gitlab CI preferred)
2+ years cloud development experience, preferably in GCP
2+ years experience designing production software and data pipelines
Experience with Python web development frameworks (Flask, Django, FastAPI)
Comprehensive knowledge of professional software engineering practices; including coding standards, code reviews, source control management, build processes, project management, testing, and operations.
Ability to work on a small team and work independently.
Preferred:
2+ years experience managing cloud infrastructure using Infrastructure-as-Code tools (ex. Terraform)
Familiarity with Cloud networking.
Familiarity with the machine learning lifecycle
A startup mentality and a passion for recycling, robotics, and changing the world
Education:
Bachelor's degree in Computer Science or similar, or equivalent combination of technical education and work experience.
Working Conditions/Physical Demands:
The physical demands described here are representative of those that must be met by an employee to successfully perform the essential functions of this job. Reasonable accommodations may be made to enable individuals with disabilities to perform the essential functions.
Prolonged periods of sitting at a desk and working on a computer.
Must be able to lift up to 15 pounds at times.
Working Location(s):
Fully-remote, hybrid, or in-person at AMP's Louisville, CO Headquarters. Occasional travel to HQ
Travel Requirements:
None
AMP provides equal employment opportunities to all employees and applicants for employment and prohibits discrimination and harassment of any type without regard to race, color, religion, age, sex, national origin, disability status, genetics, protected veteran status, sexual orientation, gender identity or expression, or any other characteristic protected by federal, state or local laws. Applicants who identify with a historically underrepresented group are encouraged to apply. This policy applies to all terms and conditions of employment, including recruiting, hiring, placement, promotion, termination, layoff, recall, transfer, leaves of absence, compensation and training.
Other duties:
Please note this job description is not designed to cover or contain a comprehensive listing of activities, duties or responsibilities that are required of the employee for this job. Duties, responsibilities, and activities may change at any time with or without notice.
: $129,831 - $160,000 per year
Salary & Compensation Information
The candidate selected for this role will be recommended for a stock option grant commensurate with the position and the candidate's qualifications.
Equity Grant:
Benefits Information:
Medical - The company covers between 78% to 100% of the premium for Cigna medical healthcare plans depending on the selection.
Dental, Vision, Short and Long Term Disability
Life Insurance: The company covers the cost of Basic Life / AD&D 1 x Salary, option to purchase additional through New York Life
Benefits start the day you start
HSA Eligible Health Plans, Employer Monthly Contributions on Dependent and Individual Plans
401(k) retirement plan (non-matching)
FTO - Flexible Time Off
6 Accrued Sick Days
Eight (8) paid holidays
We'll consider applications until the position is filled.
#LI-Remote";ai, machine learning;1;39;Full Stack Software Engineer;Louisville, CO;1754764.0;AMP Sortation;90;USD;ANNUAL;129831.0;144916.0;160000.0;3.6;2025-09-09T00:00:00;;WORK_FROM_HOME;Bachelor's degree;"<div><div><p><i>AMP is applying AI-powered sortation at scale to modernize the world's recycling infrastructure and maximize the value in waste. AMP gives waste and recycling leaders the power to harness AI to reduce labor costs, increase resource recovery, and deliver more reliable operations. With hundreds of deployments across North America, Asia, and Europe, AMP's technology offers a transformational solution to waste sortation and changes the fundamental economics of recycling.</i></p>
<p><i>
Headquartered in Louisville, Colorado, the Denver Post and BuiltIn Colorado have recognized AMP as one of the state's top workplaces. AMP has operations and career opportunities outside of Atlanta, Cleveland, Portsmouth, Virginia, and Europe. We're fostering an environment where passionate individuals can grow and create impact. We seek unconventional thinkers to join our mission to enable a world without waste; at AMP, your contributions have meaning and can spur change. With backing from top-tier investors and national recognition including North American Cleantech Company of the Year, we're always seeking ways to better our operations, raising the bar on innovation, and looking to collaborate and improve in what we do. Learn more at AMPSortation.com.</i></p></div><p><b>
AMP</b> is hiring a <b>Full-stack Software Engineer</b> reporting to <b>Engineering Manager, Machine Learning</b> on a remote basis.</p>
<p>
AMP doesn't just do machine learning, we are driven forward by it. Our core technology revolves around deep-learned models applied to robotics domains, and we are always striving to level up our offering. In this role, you'll help build and improve our ML Platform&mdash;especially the Data Annotation Platform and its supporting cloud infrastructure&mdash;working closely with our ML and Data Operations teams.</p>
<p>
As a <b>Full-stack Software Engineer,</b> you will work to:</p>
<ul>
<li>Be responsible for contributing to the maintenance and feature development of our Data Annotation platform and surrounding cloud infrastructure</li>
<li>Contribute to cross-functional projects and development efforts to support our AI lifecycle and ML platform.</li>
</ul>
<p><b>Supervisory Responsibilities:</b></p>
<ul>
<li>None</li>
</ul>
<p><b>The successful candidate will have:</b></p>
<p><b>
Required:</b></p>
<ul>
<li>5+ years of professional experience in software engineering</li>
<li>2-4 years experience writing production-level code in Python</li>
<li>2-4 years experience writing production-level code in a modern frontend Javascript framework (Angular preferred)</li>
<li>2+ years experience working with SQL databases and data pipelines</li>
<li>1+ years experience in container orchestration (Kubernetes, Docker) and CI/CD development (Gitlab CI preferred)</li>
<li>2+ years cloud development experience, preferably in GCP</li>
<li>2+ years experience designing production software and data pipelines</li>
<li>Experience with Python web development frameworks (Flask, Django, FastAPI)</li>
<li>Comprehensive knowledge of professional software engineering practices; including coding standards, code reviews, source control management, build processes, project management, testing, and operations.</li>
<li>Ability to work on a small team and work independently.</li>
</ul>
<p><b>Preferred:</b></p>
<ul>
<li>2+ years experience managing cloud infrastructure using Infrastructure-as-Code tools (ex. Terraform)</li>
<li>Familiarity with Cloud networking.</li>
<li>Familiarity with the machine learning lifecycle</li>
<li>A startup mentality and a passion for recycling, robotics, and changing the world</li>
</ul>
<p><b>Education:</b></p>
<ul>
<li>Bachelor's degree in Computer Science or similar, or equivalent combination of technical education and work experience.</li>
</ul>
<p><b>Working Conditions/Physical Demands:</b></p>
<p>
The physical demands described here are representative of those that must be met by an employee to successfully perform the essential functions of this job. Reasonable accommodations may be made to enable individuals with disabilities to perform the essential functions.</p>
<ul>
<li>Prolonged periods of sitting at a desk and working on a computer.</li>
<li>Must be able to lift up to 15 pounds at times.</li>
</ul>
<p><b>Working Location(s):</b></p>
<ul>
<li>Fully-remote, hybrid, or in-person at AMP's Louisville, CO Headquarters. Occasional travel to HQ</li>
</ul>
<p><b>Travel Requirements:</b></p>
<ul>
<li>None</li>
</ul>
<p>AMP provides equal employment opportunities to all employees and applicants for employment and prohibits discrimination and harassment of any type without regard to race, color, religion, age, sex, national origin, disability status, genetics, protected veteran status, sexual orientation, gender identity or expression, or any other characteristic protected by federal, state or local laws. Applicants who identify with a historically underrepresented group are encouraged to apply. This policy applies to all terms and conditions of employment, including recruiting, hiring, placement, promotion, termination, layoff, recall, transfer, leaves of absence, compensation and training.</p>
<p><b>
Other duties:</b></p>
<p>
Please note this job description is not designed to cover or contain a comprehensive listing of activities, duties or responsibilities that are required of the employee for this job. Duties, responsibilities, and activities may change at any time with or without notice.</p>
<p><b>
Salary &amp; Compensation Information</b>: $129,831 - $160,000 per year</p>
<p><b>
Equity Grant:</b> The candidate selected for this role will be recommended for a stock option grant commensurate with the position and the candidate's qualifications.</p>
<p><b>
Benefits Information:</b></p>
<ul>
<li>Medical - The company covers between 78% to 100% of the premium for Cigna medical healthcare plans depending on the selection.</li>
<li>Dental, Vision, Short and Long Term Disability</li>
<li>Life Insurance: The company covers the cost of Basic Life / AD&amp;D 1 x Salary, option to purchase additional through New York Life</li>
<li>Benefits start the day you start</li>
<li>HSA Eligible Health Plans, Employer Monthly Contributions on Dependent and Individual Plans</li>
<li>401(k) retirement plan (non-matching)</li>
<li>FTO - Flexible Time Off</li>
<li>6 Accrued Sick Days</li>
<li>Eight (8) paid holidays</li>
</ul>
<p>We'll consider applications until the position is filled.</p>
<p>
#LI-Remote</p></div>";Louisville, CO;Colorado;United States;39.97778;-105.13139;Tim Stuart;Louisville, CO;Electronics Manufacturing;Manufacturing;Unknown / Non-Applicable;51 to 200 Employees;Company - Private;https://ampsortation.com/;2015.0
